{
  "schemaVersion": "0.4.1-omega",
  "id": "sha256:0123456789abcdef0123456789abcdef0123456789abcdef0123456789abcdef",
  "createdAt": "2026-09-01T12:00:00Z",
  "title": "checkout-negative-total-with-coupon",
  "source": { "reporter": "qa@example.com", "environment": "staging", "repoCommit": "a1b2c3d" },
  "layers": [{ "mediaType": "application/vnd.dawg.diagnostics+tar.zstd", "digest": "sha256:abcdef0123456789abcdef0123456789abcdef0123456789abcdef0123456789", "size": 2048 }],
  "sanitize": { "policyVersion": "1.2.0", "fieldsRedacted": 14, "reviewedBy": "manual" },
  "determinism": { "clockFrozenAt": "2026-09-01T11:58:00Z", "randomSeed": 42 },
  "expectedOutcome": { "type": "assertion", "description": "total price should be non-negative", "assertionFile": "assertions/checkout.spec.json" },
  "diagnostics": {
    "formatVersion": "1", "profile": "safe", "sources": ["safe-extension"],
    "consoleEvents": 1, "networkEvents": 1, "errorEvents": 0,
    "retainedRequestBodies": 0, "retainedResponseBodies": 0, "redactedBodies": 0, "blockedBodies": 1, "truncatedBodies": 0,
    "policyVersion": "1.2.0",
    "limits": { "maxConsoleRecordBytes": 32768, "maxConsoleRecords": 10000, "maxNetworkRecords": 20000, "maxBodyBytes": 262144, "maxBodiesBytes": 20971520, "maxLayerBytes": 52428800 }
  }
}
